{
  "$schema": "https://json-schema.org/draft/2020-12/schema",
  "$id": "https://quantum-l9.github.io/l9-ci-core/schemas/preflight-report.schema.json",
  "title": "L9 Preflight Readiness Report",
  "description": "The output of scripts/evaluate_preflight.py: a per-gate verdict over the eight preflight gates, the Golden-Rule red-line check, a readiness verdict, and the single smallest next action. `ready` is true only when gates 1-7 are `pass` and no red line is tripped.",
  "type": "object",
  "additionalProperties": false,
  "required": ["generated_from", "repo", "gates", "red_lines", "ready", "next_action"],
  "properties": {
    "generated_from": {
      "type": "string",
      "description": "The probe log's TIMESTAMP (UTC=...) — evidence provenance, not the system clock."
    },
    "repo": {
      "type": "object",
      "additionalProperties": false,
      "required": ["root", "branch", "head"],
      "properties": {
        "root": { "type": "string" },
        "branch": { "type": "string" },
        "head": { "type": "string" }
      }
    },
    "strict": {
      "type": "boolean",
      "description": "True when autofix was disabled and every fixable NO is a hard stop."
    },
    "gates": {
      "type": "array",
      "minItems": 8,
      "maxItems": 8,
      "items": { "$ref": "#/$defs/gate" }
    },
    "red_lines": {
      "type": "array",
      "items": { "$ref": "#/$defs/red_line" }
    },
    "ready": {
      "type": "boolean",
      "description": "Whole-pipeline verdict. True only if gates 1-7 are `pass` and red_lines is empty."
    },
    "next_action": {
      "type": "string",
      "description": "The single smallest next action — START IMPLEMENTATION, or the first blocker's remediation."
    }
  },
  "$defs": {
    "gate": {
      "type": "object",
      "additionalProperties": true,
      "required": ["id", "name", "question", "verdict"],
      "properties": {
        "id": { "type": "integer", "minimum": 1, "maximum": 8 },
        "name": { "type": "string" },
        "question": { "type": "string" },
        "verdict": {
          "enum": ["pass", "blocked", "confirm", "adapt"],
          "description": "pass = PASS condition met. blocked = stop-and-fix. confirm = needs an expected contract or human. adapt = the blueprint is wrong for this repo; fix the blueprint, not the repo."
        },
        "taxonomy": { "type": "string", "description": "Failure class from the decision tree." },
        "evidence": { "type": "object", "description": "The probe facts the verdict rests on." },
        "red_line": { "type": "string", "description": "The Golden Rule tripped, if any." },
        "autofix": { "type": ["string", "null"], "description": "Safe non-code remediation available." },
        "remediation": { "type": ["string", "null"], "description": "The next action for this gate." }
      }
    },
    "red_line": {
      "type": "object",
      "additionalProperties": false,
      "required": ["rule", "gate"],
      "properties": {
        "rule": { "type": "string" },
        "gate": { "type": "integer", "minimum": 1, "maximum": 8 },
        "detail": { "type": "string" }
      }
    }
  }
}
